{
  "$schema": "https://json-schema.org/draft/2020-12/schema",
  "title": "Codex RALF Todo",
  "type": "object",
  "additionalProperties": false,
  "required": ["schema_version", "source_files", "tasks"],
  "properties": {
    "schema_version": { "type": "integer", "const": 1 },
    "project": {
      "type": "object",
      "additionalProperties": false,
      "properties": {
        "name": { "type": "string" },
        "root": { "type": "string" }
      }
    },
    "updated_at": { "type": "string", "format": "date-time" },
    "source_files": {
      "type": "array",
      "items": { "type": "string" }
    },
    "tasks": {
      "type": "array",
      "items": {
        "type": "object",
        "additionalProperties": false,
        "required": ["id", "title", "priority", "status"],
        "properties": {
          "id": { "type": "string" },
          "title": { "type": "string", "minLength": 1 },
          "priority": { "type": "integer", "minimum": 1, "maximum": 5 },
          "status": { "type": "string", "enum": ["todo", "doing", "blocked", "done"] },
          "details": { "type": "string" },
          "notes": { "type": "string" },
          "steps": { "type": "array", "items": { "type": "string" } },
          "blockers": { "type": "array", "items": { "type": "string" } },
          "tags": { "type": "array", "items": { "type": "string" } },
          "files": { "type": "array", "items": { "type": "string" } },
          "depends_on": { "type": "array", "items": { "type": "string" } },
          "created_at": { "type": "string", "format": "date-time" },
          "updated_at": { "type": "string", "format": "date-time" }
        }
      }
    }
  }
}
