{
  "schema_version": 1,
  "project": {
    "name": "Personal mail hub",
    "root": "."
  },
  "source_files": [
    "INDEX.md",
    "PRODUCT.md",
    "SPEC.md",
    "research/json-render-experimental.md",
    "research/modern-email-report-pdf.md",
    "research/research-1.md",
    "research/research-2.md",
    "research/research-3.md",
    "research/research.md"
  ],
  "tasks": [
    {
      "id": "T001",
      "title": "Create the TypeScript application foundation",
      "priority": 1,
      "status": "done",
      "details": "Set up the React, Vite, Fastify, PostgreSQL, Drizzle, and pg-boss application structure with pinned dependencies and shared type checking.",
      "tags": [
        "foundation",
        "architecture"
      ],
      "updated_at": "2026-09-18T21:34:31Z",
      "files": [
        "AGENTS.md",
        "apps/api",
        "apps/web",
        "apps/worker",
        "package-lock.json",
        "package.json",
        "packages/contracts",
        "packages/database",
        "tsconfig.base.json"
      ]
    },
    {
      "id": "T002",
      "title": "Implement database migrations and storage interfaces",
      "priority": 1,
      "status": "done",
      "details": "Create the specified PostgreSQL schema, indexes, constraints, and durable versus disposable storage interfaces.",
      "depends_on": [
        "T001"
      ],
      "tags": [
        "database",
        "storage"
      ],
      "updated_at": "2026-09-18T21:54:11Z",
      "files": [
        ".env.example",
        "AGENTS.md",
        "package-lock.json",
        "package.json",
        "packages/database/drizzle",
        "packages/database/drizzle.config.ts",
        "packages/database/package.json",
        "packages/database/src/index.ts",
        "packages/database/src/migrate.ts",
        "packages/database/src/schema.ts",
        "packages/database/src/storage",
        "packages/database/test",
        "packages/database/tsconfig.json"
      ]
    },
    {
      "id": "T003",
      "title": "Implement startup recovery-generation controls",
      "priority": 1,
      "status": "done",
      "details": "Block workers and mail mutations unless deployment and database recovery state match. Implement recovery modes and generation checks before idempotency lookup.",
      "depends_on": [
        "T002"
      ],
      "tags": [
        "recovery",
        "safety"
      ],
      "updated_at": "2026-09-18T22:16:58Z",
      "files": [
        ".env.example",
        "AGENTS.md",
        "apps/admin",
        "apps/api/package.json",
        "apps/api/src/main.ts",
        "apps/api/src/recovery.ts",
        "apps/api/test/recovery-gate.test.ts",
        "apps/worker/package.json",
        "apps/worker/src/main.ts",
        "package-lock.json",
        "package.json",
        "packages/contracts/src/index.ts",
        "packages/database/src/index.ts",
        "packages/recovery",
        "to-do.json"
      ]
    },
    {
      "id": "T004",
      "title": "Implement passkey owner authentication and recovery",
      "priority": 1,
      "status": "done",
      "details": "Provide console bootstrap enrollment, WebAuthn passkeys, session revocation, recent verification, last-credential protection, and operator recovery.",
      "depends_on": [
        "T002",
        "T003"
      ],
      "tags": [
        "authentication",
        "security"
      ],
      "updated_at": "2026-09-18T22:49:40Z",
      "files": [
        ".env.example",
        "AGENTS.md",
        "apps/admin/package.json",
        "apps/admin/src/main.ts",
        "apps/admin/test/commands.test.ts",
        "apps/api/package.json",
        "apps/api/src/app.ts",
        "apps/api/src/auth-routes.ts",
        "apps/api/src/main.ts",
        "apps/api/test/auth-routes.test.ts",
        "packages/auth/package.json",
        "packages/auth/src/config.ts",
        "packages/auth/src/console.ts",
        "packages/auth/src/errors.ts",
        "packages/auth/src/index.ts",
        "packages/auth/src/service.ts",
        "packages/auth/src/state.ts",
        "packages/auth/src/tokens.ts",
        "packages/auth/test/fake-authenticator.ts",
        "packages/auth/test/service.test.ts",
        "packages/auth/tsconfig.json",
        "packages/contracts/src/index.ts",
        "packages/database/drizzle/0001_owner_auth.sql",
        "packages/database/drizzle/meta/0001_snapshot.json",
        "packages/database/drizzle/meta/_journal.json",
        "packages/database/src/schema.ts",
        "packages/database/test/migrations.test.ts"
      ]
    },
    {
      "id": "T005",
      "title": "Implement encrypted account and identity management",
      "priority": 1,
      "status": "done",
      "details": "Store mailbox credentials with AES-256-GCM, manage account labels and colors, discover folders, map roles, and manage validated send identities. Implemented and committed in 72b92cc; this pass re-verified workspace type checks and the full test suite, including the PostgreSQL-backed suites via TEST_DATABASE_URL, and needed no code changes.",
      "depends_on": [
        "T002",
        "T004"
      ],
      "tags": [
        "accounts",
        "security"
      ],
      "updated_at": "2026-09-18T23:29:13Z",
      "files": [
        ".env.example",
        "AGENTS.md",
        "apps/api/package.json",
        "apps/api/src/account-routes.ts",
        "apps/api/src/main.ts",
        "apps/api/src/recovery.ts",
        "apps/api/test/account-routes.test.ts",
        "package-lock.json",
        "packages/accounts/package.json",
        "packages/accounts/src/crypto.ts",
        "packages/accounts/src/errors.ts",
        "packages/accounts/src/index.ts",
        "packages/accounts/src/service.ts",
        "packages/accounts/src/validation.ts",
        "packages/accounts/test/crypto.test.ts",
        "packages/accounts/test/service.test.ts",
        "packages/accounts/tsconfig.json",
        "packages/contracts/src/index.ts",
        "packages/database/src/schema.ts",
        "to-do.json"
      ]
    },
    {
      "id": "T006",
      "title": "Implement verified IMAP and SMTP connection tests",
      "priority": 1,
      "status": "done",
      "details": "Require validated TLS for IMAP and SMTP, test each protocol separately, discover IMAP capabilities, and never send credentials before encryption succeeds. Implemented and committed in 985bf63; this pass re-verified workspace type checks and the full test suite, including the PostgreSQL-backed suites via TEST_DATABASE_URL, and needed no code changes.",
      "depends_on": [
        "T005"
      ],
      "tags": [
        "transport",
        "security"
      ],
      "updated_at": "2026-09-19T00:23:26Z",
      "files": [
        "AGENTS.md",
        "apps/api/package.json",
        "apps/api/src/connection-test-routes.ts",
        "apps/api/src/main.ts",
        "apps/api/test/connection-test-routes.test.ts",
        "packages/contracts/src/index.ts",
        "packages/transport/package.json",
        "packages/transport/src/classify.ts",
        "packages/transport/src/imap.ts",
        "packages/transport/src/index.ts",
        "packages/transport/src/service.ts",
        "packages/transport/src/smtp.ts",
        "packages/transport/src/tls.ts",
        "packages/transport/test/connection.test.ts",
        "packages/transport/test/fake-imap-server.ts",
        "packages/transport/test/fake-smtp-server.ts",
        "packages/transport/test/test-certificates.ts",
        "packages/transport/tsconfig.json",
        "to-do.json"
      ]
    },
    {
      "id": "T007",
      "title": "Build durable MIME ingestion and parsing",
      "priority": 1,
      "status": "done",
      "details": "Store original bytes before processing, parse headers and bodies, sanitize HTML, index text, and persist verified attachment locators and hashes.",
      "depends_on": [
        "T002"
      ],
      "tags": [
        "mime",
        "storage"
      ],
      "updated_at": "2026-09-19T00:42:03Z",
      "files": [
        "AGENTS.md",
        "packages/contracts/src/index.ts",
        "packages/ingestion/package.json",
        "packages/ingestion/src/errors.ts",
        "packages/ingestion/src/index.ts",
        "packages/ingestion/src/parse.ts",
        "packages/ingestion/src/sanitize.ts",
        "packages/ingestion/src/service.ts",
        "packages/ingestion/src/text.ts",
        "packages/ingestion/test/fixtures.ts",
        "packages/ingestion/test/parse.test.ts",
        "packages/ingestion/test/sanitize.test.ts",
        "packages/ingestion/test/service.test.ts",
        "packages/ingestion/tsconfig.json",
        "to-do.json"
      ]
    },
    {
      "id": "T008",
      "title": "Build resumable IMAP backfill",
      "priority": 1,
      "status": "done",
      "details": "Import header ranges newest first with transactional checkpoints, UIDVALIDITY checks, bounded batches, and background body jobs. Done: new packages/sync (ImapFlow session factory with verified implicit TLS and BODY.PEEK only, header-block import mirroring ingestion normalization, BackfillService with one-transaction window commits, BodyFetchService over the durable fetched_body=false pending set, SyncRunner bounded per-account cycles) wired into the worker as a generation-gated sync.cycle cron; PostgreSQL-backed acceptance suite included.",
      "depends_on": [
        "T005",
        "T007"
      ],
      "tags": [
        "sync",
        "imap"
      ],
      "updated_at": "2026-09-19T01:10:16Z",
      "files": [
        "AGENTS.md",
        "apps/worker/package.json",
        "apps/worker/src/main.ts",
        "package-lock.json",
        "packages/sync/package.json",
        "packages/sync/src/backfill.ts",
        "packages/sync/src/bodies.ts",
        "packages/sync/src/errors.ts",
        "packages/sync/src/headers.ts",
        "packages/sync/src/imap-session.ts",
        "packages/sync/src/index.ts",
        "packages/sync/src/mailbox.ts",